<?xml version="1.0" encoding="ISO-8859-1"?>
<!-- created by MXML on Tue Apr 12 19:26:38 2005 -->
<Configuration xmlns:xsi="http://www.w3.org/2001/XMLSchema-instance" xsi:noNamespaceSchemaLocation="c:/Argus/ArgusConfig.xsd">
  <MainConfiguration>
    <Window>
      <Scale>1.0</Scale>
      <StatusBar>true</StatusBar>
    </Window>
    <DataBase>
      <Type>none</Type>
      <Connection></Connection>
    </DataBase>
    <Online>
      <Host></Host>
      <Experiment></Experiment>
    </Online>
    <SocketInterface>
      <Host></Host>
      <PortNumber>9090</PortNumber>
    </SocketInterface>
    <Tabs>
      <Tab>
        <TabName>Tab1</TabName>
        <Active>true</Active>
        <SteeringParameterField>
          <SPName>text</SPName>
          <SPValue>steering parameter</SPValue>
        </SteeringParameterField>
      </Tab>
      <Tab>
        <TabName>Tab2</TabName>
        <Active>true</Active>
      </Tab>
    </Tabs>
  </MainConfiguration>
</Configuration>
