<?xml version="1.0" encoding="ISO-8859-1"?>
<!-- created by ROME on Fri Mar 11 19:05:35 2005
 -->
<Configuration xmlns:xsi="http://www.w3.org/2001/XMLSchema-instance" xsi:noNamespaceSchemaLocation="c:/Argus/ArgusConfig.xsd">
     <MainConfiguration>
          <Window>
               <Scale>1.0</Scale>
          </Window>
          <DataBase>
               <Type>none</Type>
               <Connection></Connection>
          </DataBase>
          <Online>
               <Host></Host>
               <Experiment></Experiment>
          </Online>
          <SocketInterface>
               <Host>localhost</Host>
               <PortNumber>9090</PortNumber>
          </SocketInterface>
          <Tabs>
               <Tab>
                    <TabName>Tab</TabName>
                    <Active>true</Active>
               </Tab>
          </Tabs>
     </MainConfiguration>
</Configuration>
